{
  "schemaVersion": "1.0.0",
  "runId": "68251170-2d5c-4441-b15a-c281db28bfa3",
  "capabilityId": "lookup-savings-balance",
  "status": "success",
  "outputs": {
    "savingsBalance": "$1,842.17"
  },
  "events": [
    {
      "at": "2026-09-18T05:45:52.308Z",
      "kind": "step_ok",
      "stepIndex": 0,
      "why": "Enter the member identifier into the lookup field"
    },
    {
      "at": "2026-09-18T05:45:56.838Z",
      "kind": "recovered",
      "stepIndex": 1,
      "why": "slow load waited out"
    },
    {
      "at": "2026-09-18T05:45:59.084Z",
      "kind": "step_ok",
      "stepIndex": 1,
      "why": "Submit the member search"
    },
    {
      "at": "2026-09-18T05:45:59.099Z",
      "kind": "step_ok",
      "stepIndex": 2,
      "why": "Read the current savings balance from the member record"
    }
  ],
  "driftWarnings": [],
  "evidence": {
    "screenshots": [
      "evidence/replay-slow-1789710349652/screenshots/final.jpg"
    ]
  }
}
