{
  "schemaVersion": "1.0.0",
  "runId": "f0866ca3-bdb2-4207-b54c-7ffdc886737d",
  "capabilityId": "lookup-savings-balance",
  "status": "success",
  "outputs": {
    "savingsBalance": "$1,842.17"
  },
  "events": [
    {
      "at": "2026-09-18T03:14:29.012Z",
      "kind": "step_ok",
      "stepIndex": 0,
      "why": "Enter the member identifier into the lookup field"
    },
    {
      "at": "2026-09-18T03:14:29.012Z",
      "kind": "escalation_requested",
      "why": "pauseAfterStep — operator takeover"
    },
    {
      "at": "2026-09-18T03:14:29.055Z",
      "kind": "human_action",
      "why": "click forwarded as nx,ny plus viewport",
      "detail": {
        "nx": 0.24171875,
        "ny": 0.2791666666666667,
        "viewport": {
          "width": 1100,
          "height": 720
        },
        "locator": {
          "candidates": [
            {
              "strategy": "role_name",
              "role": "button",
              "name": "Look up",
              "weak": false
            }
          ],
          "fingerprint": {
            "role": "button",
            "name": "Look up",
            "candidateCount": 1,
            "framePath": []
          },
          "framePath": []
        }
      }
    },
    {
      "at": "2026-09-18T03:14:29.142Z",
      "kind": "drift_warning",
      "stepIndex": 1,
      "why": "locator fingerprint changed"
    },
    {
      "at": "2026-09-18T03:14:29.145Z",
      "kind": "recovered",
      "stepIndex": 1,
      "why": "click already satisfied by human"
    },
    {
      "at": "2026-09-18T03:14:29.163Z",
      "kind": "step_ok",
      "stepIndex": 1,
      "why": "Submit the member search"
    },
    {
      "at": "2026-09-18T03:14:29.179Z",
      "kind": "step_ok",
      "stepIndex": 2,
      "why": "Read the current savings balance from the member record"
    }
  ],
  "driftWarnings": [
    {
      "stepIndex": 1,
      "expected": "count=1",
      "observed": "count=0"
    }
  ],
  "evidence": {
    "screenshots": [
      "evidence/hitl-local/screenshots/takeover.jpg"
    ]
  }
}
